CODE,DESCRIPTION,,,,,
K25.4,"Gastric ulcer, acute / Acute erosion of stomach/ Pyloruspeptic ulcer / Stomach peptic ulcer, chronic or unspecifiedwith haemorrhage",,,,,
K25.5,"Gastric ulcer, acute / Acute erosion of stomach/ Pyloruspeptic ulcer / Stomach peptic ulcer, chronic or unspecifiedwith perforation",,,,,
K25.6,"Gastric ulcer, acute / Acute erosion of stomach/ Pyloruspeptic ulcer / Stomach peptic ulcer, chronic or unspecifiedwith both haemorrhage and perforation",,,,,
K26.0,"Duodenal ulcer, acute / Acute erosion of duodenum/Duodenal peptic  ulcer/ Postpyloric peptic  ulcer withhaemorrhage",,,,,
K26.1,"Duodenal ulcer, acute / Acute erosion of duodenum/Duodenal peptic  ulcer/ Postpyloric peptic  ulcer withperforation",,,,,
K26.4,"Chronic Duodenal/ Postpyloric ulcer/ erosion, orunspecified with haemorrhage",,,,,
K26.5,"Chronic Duodenal/ Postpyloric ulcer/ erosion, orunspecified with perforation",,,,,
K26.6,"Chronic Duodenal/ Postpyloric ulcer/ erosion, orunspecified with both haemorrhage and perforation",,,,,
K27.0,"Acute Peptic ulcer/ Gastroduodenal ulcer NOS, siteunspecified,  with haemorrhage",,,,,
K27.1,"Acute Peptic ulcer / Gastroduodenal ulcer, site unspecified,with perforation",,,,,
K27.2,"Acute Peptic/ Gastroduodenal ulcer, site unspecified,  withboth haemorrhage and perforation",,,,,
K27.4,"Chronic  or unspecified Peptic/ Gastroduodenal ulcer, siteunspecified,  with haemorrhage",,,,,
K27.5,"Chronic or unspecified Peptic/ Gastroduodenal ulcer, siteunspecified  with perforation",,,,,
K27.6,"Chronic or unspecified Peptic/ Gastroduodenal ulcer, siteunspecified, with both haemorrhage and perforation",,,,,
K28.0,"Acute Gastrojejunal ulcer/ Anastomotic peptic ulcer orerosion/ Gastrocolic peptic ulcer or erosion/Gastrointestinal peptic ulcer or erosion/ Gastrojejunalpeptic ulcer or erosion/ Jejunal peptic ulcer or erosion/Marginal peptic ulcer or erosion/ Stomal peptic ulcer orerosion",,,,,
K28.1,"Acute Gastrojejunal ulcer/ Anastomotic peptic ulcer orerosion/ Gastrocolic peptic ulcer or erosion/Gastrointestinal peptic ulcer or erosion/ Gastrojejunalpeptic ulcer or erosion/ Jejunal peptic ulcer or erosion/Marginal peptic ulcer or erosion/ Stomal peptic ulcer orerosion",,,,,
K28.2,"Acute Gastrojejunal ulcer/ Anastomotic peptic ulcer orerosion/ Gastrocolic peptic ulcer or erosion/Gastrointestinal peptic ulcer or erosion/ Gastrojejunalpeptic ulcer or erosion/ Jejunal peptic ulcer or erosion/Marginal peptic ulcer or erosion/ Stomal peptic ulcer orerosion",,,,,
K28.3,"Acute Gastrojejunal ulcer/ Anastomotic peptic ulcer orerosion/ Gastrocolic peptic ulcer or erosion/Gastrointestinal peptic ulcer or erosion/ Gastrojejunalpeptic ulcer or erosion/ Jejunal peptic ulcer or erosion/Marginal peptic ulcer or erosion/ Stomal peptic ulcer orerosion",,,,,
ICD 10 CODE,DESCRIPTION,,,,,
,,,,,,
K28.5,"Chronic or unspecified Gastrojejunal ulcer/ Anastomoticpeptic ulcer or erosion/ Gastrocolic peptic ulcer or erosion/Gastrointestinal peptic ulcer or erosion/ Gastrojejunalpeptic ulcer or erosion/ Jejunal peptic ulcer or erosion/Marginal peptic ulcer or erosion/ Stomal peptic ulcer orerosion",,,,,
K28.6,"Chronic or unspecified Gastrojejunal ulcer/ Anastomoticpeptic ulcer or erosion/ Gastrocolic peptic ulcer or erosion/Gastrointestinal peptic ulcer or erosion/ Gastrojejunalpeptic ulcer or erosion/ Jejunal peptic ulcer or erosion/Marginal peptic ulcer or erosion/ Stomal peptic ulcer orerosion",,,,,
K29.0,"Acute haemorrhagic gastritis; Acute erosive gastritis withhaemorrhage",,,,,
K25.3,"Gastric ulcer, acute / Acute erosion of stomach/ Pyloruspeptic ulcer / Stomach peptic ulcer without haemorrhageor perforation",,,,,
K25.7,"Gastric/ Peptic/ Pyloric ulcer/ erosion, chronic withouthaemorrhage or perforation",,,,,
K25.9,"Gastric/ Peptic/ Pyloric ulcer/ erosion, unspecified as acuteor chronic, without haemorrhage or perforation",,,,,
K26.3,"Duodenal ulcer, acute / Acute erosion of duodenum/Duodenal peptic  ulcer/ Postpyloric peptic  ulcer withouthaemorrhage or perforation",,,,,
K26.7,"Chronic Duodenal/ Postpyloric ulcer/ erosion, withouthaemorrhage or perforation",,,,,
K26.9,"Duodenal/ Postpyloric ulcer/ erosion, unspecified as acuteor chronic, without haemorrhage or perforation",,,,,
K27.3,"Acute Peptic/ Gastroduodenal ulcer, site unspecified,without haemorrhage or perforation; gastroduodenal ulcerNOS; Peptic ulcer NOS",,,,,
K27.7,"Chronic Peptic/ Gastroduodenal ulcer, site unspecified,without haemorrhage or perforation; gastroduodenal ulcerNOS; Peptic ulcer NOS",,,,,
K27.9,"Peptic/ Gastroduodenal ulcer, unspecified as acute orchronic, without haemorrhage or perforation;gastroduodenal ulcer NOS; Peptic ulcer NOS",,,,,
K28.7,"Chronic Gastrojejunal ulcer/ Anastomotic peptic ulcer orerosion/ Gastrocolic peptic ulcer or erosion/Gastrointestinal peptic ulcer or erosion/ Gastrojejunalpeptic ulcer or erosion/ Jejunal peptic ulcer or erosion/Marginal peptic ulcer or erosion/ Stomal  peptic ulcer orerosion",,,,,
K28.9,"Unspecified as acute or chronic Gastrojejunal ulcer/Anastomotic peptic ulcer or erosion/ Gastrocolic pepticulcer or erosion/ Gastrointestinal peptic ulcer or erosion/Gastrojejunal peptic ulcer or erosion/ Jejunal peptic ulceror erosion/ Marginal peptic ulcer or erosion; Stomal pepticulcer or erosion",,,,,
K29.1,Other acute gastritis,,,,,
K29.2,Alcoholic gastritis,,,,,
K29.3,Chronic superficial gastritis,,,,,
K29.4,Chronic atrophic gastritis; Gastric atrophy,,,,,
K29.5,"Chronic gastritis, unspecified; Chronic Antral gastritis;Chronic Fundal gastritis",,,,,
K29.6,"Other gastritis; Giant hypertrophic gastritis; Granulomatousgastritis; Menetrier's disease",,,,,
K29.7,"Gastritis, unspecified",,,,,
K29.8,Duodenitis,,,,,
K29.9,"Gastroduodenitis, unspecified",,,,,
P23.0,Congenital pneumonia due to viral agent,,,,,
P23.1,Congenital pneumonia due to Chlamydia,,,,,
P23.2,Congenital pneumonia due to staphylococcus,,,,,
P23.3,"Congenital pneumonia due to streptococcus, group B",,,,,
P23.4,Congenital pneumonia due to Escherichia coli,,,,,
P23.5,Congenital pneumonia due to Pseudomonas,,,,,
P23.6,"Congenital pneumonia due to other bacterial agents;Haemophilus influenzae; Klebsiella pneumonia;Mycoplasma; Streptococcus, except group B",,,,,
ICD 10 CODE,DESCRIPTION,,,,,
,,,,,,
P35.0,"Congenital rubella syndrome; Congenital rubellapneumonitis",,,,,
P35.1,Congenital cytomegalovirus infection,,,,,
P35.2,Congenital herpesviral [herpes simplex] infection,,,,,
P35.3,Congenital viral hepatitis,,,,,
P35.8,"Other congenital viral diseases; Congenital varicella[chickenpox]",,,,,
P35.9,"Congenital viral disease, unspecified",,,,,
P37.0,Congenital tuberculosis,,,,,
P37.1,"Congenital toxoplasmosis; Hydrocephalus due to congenitaltoxoplasmosis",,,,,
P37.3,Congenital falciparum malaria,,,,,
P37.5,Neonatal candidiasis,,,,,
P37.8,Other specified congenital infectious and parasitic diseases,,,,,
P37.9,"Congenital infectious and parasitic disease, unspecified",,,,,
P38,Omphalitis of newborn with or without mild haemorrhage,,,,,
P39.0,Neonatal infective mastitis,,,,,
P39.1,"Neonatal conjunctivitis and dacryocystitis; Neonatalchlaydial conjunctivitis; Ophthalmia neonatorum NOS",,,,,
P39.2,"Intra-amniotic infection of fetus, not elsewhere classified",,,,,
P39.3,Neonatal urinary tract infection,,,,,
P39.4,Neonatal skin infection; Neonatal pyoderma,,,,,
P39.8,Other specified infections specific to the perinatal period,,,,,
P39.9,"Infection specific to the perinatal period, unspecified",,,,,
K66.0,"Peritoneal adhesions; Adhesions of abdominal wall;Adhesions of diaphragm; Adhesions of intestine; Adhesionsof male pelvis; Mesenteric Adhesions;  Adhesions ofomentum; Adhesions of stomach; Adhesive bands",,,,,
K66.8,Other specified disorders of peritoneum,,,,,
K66.9,"Disorder of peritoneum, unspecified",,,,,
K65.0,"Acute peritonitis; Abdominopelvic abscess; Mesentericabscess; Abscess of omentum; Abscess of peritoneum;Retrocaecal abscess; Retroperitoneal abscess;Subdiaphragmatic abscess; Subhepatic abscess; Subphrenicabscess; Acute Generalized peritonitis; Acute male pelvicperitonitis; Acute subphrenic peritonitis; Acute suppurativeperitonitis",,,,,
K65.8,"Other peritonitis; Chronic proliferative peritonitis;Mesentric fat necrosis; Mesentric saponification; Peritonitisdue to bile; Peritonitis due to urine",,,,,
K65.9,"Peritonitis, unspecified",,,,,
Q85.8,"Other phakomatoses, not elsewhere classified;  Peutz-Jeghers Syndrome;  Sturge-Weber(-Dimitri)Syndrome;  vonHippel-Lindau Syndrome",,,,,
Q85.9,"Phakomatosis, unspecified; Hamartosis NOS",,,,,
J90,"Pleural effusion, not elsewhere classified; Pleurisy witheffusion",,,,,
J91*,Pleural effusion in conditions classified elsewhere,,,,,
B20.6,HIV disease resulting in pneumocystis carinii pneumonia,,,,,
J12.03,"Adenoviral pneumonia, high risk",,,,,
J12.13,"Respiratory syncytial virus pneumonia, high risk",,,,,
J12.23,"Parainfluenza virus pneumonia, high risk",,,,,
J12.33,"Human metapneumovirus pneumonia, high risk",,,,,
J12.93,"Viral pneumonia, high risk",,,,,
J13.3,"Pneumonia [bronchopneumonia]due to Streptococcuspneumoniae, high risk",,,,,
J14.3,"Pneumonia [bronchopneumonia] due to Haemophilusinfluenzae, high risk",,,,,
J15.03,"Pneumonia due to Klebsiella pneumoniae, high risk",,,,,
J15.13,"Pneumonia due to Pseudomonas, high risk",,,,,
J15.23,"Pneumonia due to staphylococcus, high risk",,,,,
J15.33,"Pneumonia due to streptococcus, group B, high risk",,,,,
J15.43,"Pneumonia due to other streptococci, high risk",,,,,
J15.53,"Pneumonia due to Escherichia coli, high risk",,,,,
J15.63,"Pneumonia due to other aerobic Gram-negative bacteria;Pneumonia due to Serratia marcescens, high risk",,,,,
J15.73,"Pneumonia due to Mycoplasma pneumoniae, high risk",,,,,
J15.93,"Bacterial pneumonia [bronchopneumonia], high risk",,,,,
J16.03,"Chlamydial pneumonia, high risk",,,,,
ICD 10 CODE,DESCRIPTION,,,,,
,,,,,,
J18.13,"Lobar pneumonia, high risk",,,,,
J18.23,"Hypostatic pneumonia, high risk",,,,,
J18.93,"Community-acquired pneumonia IV(This classification utilized the American Thoracic Societyrecommendation. This is equivalent to CAP, high risk in thePhilippine Clinical Practice Guidelines on the Diagnosis,Empiric Management, and Prevention of Community-acquired Pneumonia in Immunocompetent Adults, 2010update)Adult high risk Community Acquired Pneumonia (CAP),organism is not specifiedPedia Community Acquired Pneumonia D (PCAP-D) highrisk, organism is not specified",,,,,
"J18.99, Y95","Nosocomial pneumoniaHealth care associated pneumonia",,,,,
A01.0+ J17.0*,Pneumonia in typhoid fever,,,,,
A02.2+ J17.0*,Pneumonia in salmonella infection,,,,,
A21.2+ J17.0*,Pneumonia in tularemia,,,,,
A22.1+ J17.0*,Pneumonia in anthrax,,,,,
A31.0,"Pulmonary mycobacterial infection;  Infection due toMycobacterium avium, Mycobacterium intracellulare[Battey bacillus]; Mycobacterium  kansasii",,,,,
A37.0+ J17.0*,Pneumonia in whooping cough due to Bordatella pertusis,,,,,
A37.1+ J17.0*,"Pneumonia in whooping cough due to Bordatellaparapertusis",,,,,
A37.8+ J17.0*,"Pneumonia in whooping cough due to Bordatella speciesother than pertusis or parapertusis",,,,,
A37.9+ J17.0*,Pneumonia in whooping cough,,,,,
A42.0+ J17.0*,Pneumonia in actinomycoses,,,,,
A48.1,Legionnaires' disease,,,,,
A43.0+ J17.0*,Pneumonia in nocardiosis,,,,,
A54.8+ J17.0*,Pneumonia in gonorrhea,,,,,
A69.8+ J17.8*,Pneumonia in spirochaetal,,,,,
A70+ J17.8*,Pneumonia in ornithosis,,,,,
A78+ J17.8*,Pneumonia in Q fever,,,,,
B01.2+ J17.1*,Pneumonia in varicella,,,,,
B05.2+ J17.1*,Pneumonia in measles,,,,,
B06.8+ J17.1*,Pneumonia in rubella,,,,,
B25.0+ J17.1*,Pneumonia in cytomegalovirus disease,,,,,
B37.1+ J17.2*,Pneumonia in candidiasis,,,,,
B38.0+ J17.2*,Pneumonia in acute pulmonary coccidiomycosis,,,,,
B38.1+ J17.2*,Pneumonia in chronic pulmonary coccidiomycosis,,,,,
B38.2+ J17.2*,Pneumonia in pulmonary coccidioidomycosis,,,,,
B39.0+ J17.2*,Pneumonia in acute pulmonary histoplasmosis capsulati,,,,,
B39.1+ J17.2*,Pneumonia in chronic pulmonary histoplasmosis capsulati,,,,,
B39.2+ J17.2*,Pneumonia in  pulmonary histoplasmosis capsulati,,,,,
B39.9+ J17.2*,Pneumonia in histoplasmosis,,,,,
B44.0+ J17.2*,Pneumonia in invasive pulmonary aspergillosis,,,,,
B44.1+ J17.2*,Pneumonia in other pulmonary aspergillosis,,,,,
B58.3+ J17.3*,Pneumonia in taxoplasmosis,,,,,
B65.0+ J17.3*,"Pneumonia in  schistosomiasis due to Schistosomahematobium",,,,,
B65.1+ J17.3*,Pneumonia in  schistosomiasis due to Schistosoma mansoni,,,,,
B65.2+ J17.3*,"Pneumonia in  schistosomiasis due to Schistosomajaponicum",,,,,
B65.8+ J17.3*,"Pneumonia in  schistosomiasis due to Schistosomaintercalatum; mattheei; mekongi",,,,,
B65.9+ J17.3*,Pneumonia in  schistosomiasis,,,,,
B77.8+ J17.3*,Pneumonia in  ascariasis,,,,,
I00+ J17.8*,Pneumonia in rheumatic fever,,,,,
J12.02,"Adenoviral pneumonia, moderate risk",,,,,
J12.12,"Respiratory syncytial virus pneumonia, moderate risk",,,,,
J12.22,"Parainfluenza virus pneumonia, moderate risk",,,,,
J12.32,"Human metapneumovirus pneumonia, moderate risk",,,,,
J12.92,"Viral pneumonia, moderate risk",,,,,
J13.2,"Pneumonia [bronchopneumonia] due to Streptococcuspneumoniae, moderate risk",,,,,
J14.2,"Pneumonia [bronchopneumonia]due to Haemophilusinfluenzae, moderate risk",,,,,
J15.02,"Pneumonia due to Klebsiella pneumoniae, moderate risk",,,,,
J15.12,"Pneumonia due to Pseudomonas, moderate risk",,,,,
ICD 10 CODE,DESCRIPTION,,,,,
,,,,,,
J15.32,"Pneumonia due to streptococcus, group B, moderate risk",,,,,
J15.42,"Pneumonia due to other streptococci, moderate risk",,,,,
J15.52,"Pneumonia due to Escherichia coli, moderate risk",,,,,
J15.62,"Pneumonia due to other aerobic Gram-negative bacteria;Pneumonia due to Serratia marcescens, moderate risk",,,,,
J15.72,"Pneumonia due to Mycoplasma pneumoniae, moderaterisk",,,,,
J15.92,"Bacterial pneumonia [bronchopneumonia], moderate risk",,,,,
J16.02,"Chlamydial pneumonia, moderate risk",,,,,
J18.02,"Bronchopneumonia, moderate risk",,,,,
J18.12,"Lobar pneumonia, moderate risk",,,,,
J18.22,"Hypostatic pneumonia, moderate risk",,,,,
J18.92,"Community-acquired pneumonia III(This classification utilized the American Thoracic Societyrecommendation. This is equivalent to CAP, moderate riskin the Philippine Clinical Practice Guidelines on theDiagnosis, Empiric Management, and Prevention ofCommunity- acquired Pneumonia in ImmunocompetentAdults, 2010 update)Adult moderate risk Community Acquired Pneumonia(CAP), organism is not specifiedPedia Community Acquired Pneumonia C (PCAP-C)moderate risk, organism is not specified",,,,,
J93.0,Spontaneous tension pneumothorax,,,,,
J93.1,"Other spontaneous pneumothoraxSpontaneous pneumothorax",,,,,
J93.8,Other pneumothorax,,,,,
J93.9,"Pneumothorax, unspecified",,,,,
T40.2,"Poisoning by Otheropioids; Poisoning by Codeine;Poisoning by Morphine",,,,,
T40.4,"Poisoning by Other synthetic narcotics; Poisoning byPethidine",,,,,
T40.6,Poisoning by Other and unspecified narcotics,,,,,
T40.7,Poisoning by Cannabis (derivatives),,,,,
T40.9,"Poisoning by Other and unspecified psychodysleptics[hallucinogens]; Poisoning by Mescaline; Poisoning byPsilocin; Poisoning by Psilocybine",,,,,
T41.0,Poisoning by Inhaled anaesthetics,,,,,
T41.1,Poisoning by Intravenous anaesthetics; Thiobarbiturates,,,,,
T41.3,Poisoning by Local anaesthetics,,,,,
T41.5,Poisoning by Therapeutic gases; Carbon dioxide; Oxygen,,,,,
T42.0,Poisoning by Hydantoin derivatives,,,,,
T42.1,Poisoning by Iminostilbenes; Carbamazepine,,,,,
T42.2,Poisoning by Succinimides and oxazolidinediones,,,,,
T42.3,Poisoning by Barbiturates,,,,,
T42.4,Poisoning by Benzodiazepines,,,,,
T42.6,"Poisoning by Other antiepileptic and sedative-hypnoticdrugs; Poisoning by Methaqualone;Poisoning byValproic acid",,,,,
T42.7,"Poisoning by Antiepileptic and sedative-hypnotic drugs,unspecified; Poisoning by Draught sleeping NOS; Poisoningby Sleeping drug NOS;Poisoning by  Sleeping tablet NOS",,,,,
T42.8,"Poisoning by Antiparkinsonism drugs and other centralmuscle-tone depressants; Poisoning by Amantadine",,,,,
T43.2,Poisoning by Other and unspecified antidepressants,,,,,
T43.3,Poisoning by Phenothiazine antipsychotics and neuroleptics,,,,,
T43.4,"Poisoning by Butyrophenone and thioxantheneneuroleptics",,,,,
ICD 10 CODE,DESCRIPTION,,,,,
,,,,,,
T43.6,Poisoning by Psychostimulants with abuse potential,,,,,
T43.9,"Poisoning by Psychotropic drug, unspecified",,,,,
T44.1,Poisoning by Other parasympathomimetics [cholinergics],,,,,
T44.2,"Poisoning by Ganglionic blocking drugs, not elsewhereclassified",,,,,
T44.3,"Poisoning by Other parasympatholytics [anticholinergicsand antimuscarinics] and spasmolytics, not elsewhereclassified; Poisoning byPapaverine",,,,,
T44.4,"Poisoning by Predominantly α-adrenoreceptor agonists, notelsewhere classified; Poisoning by  Metaraminol",,,,,
T44.5,"Poisoning by Predominantly ß-adrenoreceptor agonists, notelsewhere classified",,,,,
T44.6,"Poisoning by α-Adrenoreceptor antagonists, not elsewhereclassified",,,,,
T44.7,"Poisoning by ß-Adrenoreceptor antagonists, not elsewhereclassified",,,,,
T44.9,"Poisoning by Other and unspecified drugs primarilyaffecting the autonomic nervous system; Drug stimulatingboth  α-and ß-adrenoreceptors",,,,,
T45.0,Poisoning by Antiallergic and antiemetic drugs,,,,,
T45.1,"Poisoning by Antineoplastic and immunosuppressive drugs;Poisoning by Antineoplastic antibiotics; Poisoning byCytarabine",,,,,
T45.2,"Poisoning by Vitamins, not elsewhere classified",,,,,
T45.3,"Poisoning by Enzymes, not elsewhere classified",,,,,
T50.7,Poisoning by Analeptics and opioid receptor antagonists,,,,,
Y46.2,"Drugs, medicaments and biological substances causingadverse effects in therapeuticuse: Hydantoin derivatives",,,,,
Y46.6,"Drugs, medicaments and biological substances causingadverse effects in therapeuticuse: Other and unspecified antiepileptics",,,,,
Y47.0,"Drugs, medicaments and biological substances causingadverse effects in therapeuticuse: Barbiturates, not elsewhere classified",,,,,
Y47.1,"Drugs, medicaments and biological substances causingadverse effects in therapeuticuse: Benzodiazepines",,,,,
Y47.9,"Drugs, medicaments and biological substances causingadverse effects in therapeuticuse: Sedative, hypnotic and antianxiety drug,unspecified;sleeping draught NOS;sleeping drugNOS;sleeping tablet NOS",,,,,
Y49.5,"Drugs, medicaments and biological substances causingadverse effects in therapeuticuse: Other antipsychotics and neuroleptics",,,,,
Y49.6,"Drugs, medicaments and biological substances causingadverse effects in therapeuticuse: Psychodysleptics [hallucinogens]",,,,,
Y51.3,"Drugs, medicaments and biological substances causingadverse effects in therapeuticuse: Other parasympatholytics [anticholinergics andantimuscarinics] and spasmolytics, not elsewhereclassified;papaverine",,,,,
Y51.7,"Drugs, medicaments and biological substances causingadverse effects in therapeuticuse: Beta-adrenoreceptor antagonists, not elsewhereclassified",,,,,
T36.0,Poisoning by Penicillins,,,,,
T36.1,Poisoning by Cefalosporins and other ß-lactam antibiotics,,,,,
T36.2,Poisoning by Chloramphenicol group,,,,,
T36.3,Poisoning by Macrolides,,,,,
T36.4,Poisoning by Tetracyclines,,,,,
T36.5,Poisoning by Aminoglycosides; Streptomycin,,,,,
T36.6,Poisoning by Rifamycins,,,,,
T36.8,Poisoning by Other systemic antibiotics,,,,,
ICD 10 CODE,DESCRIPTION,,,,,
,,,,,,
T37.0,Poisoning by Sulfonamides,,,,,
T37.1,Poisoning by Antimycobacterial drugs,,,,,
T37.2,"Poisoning by Antimalarials and drugs acting on other bloodprotozoa",,,,,
T37.4,Poisoning by Anthelminthics,,,,,
T37.5,Poisoning by Antiviral drugs,,,,,
T37.8,"Poisoning by Other specified systemic anti-infectives andantiparasitics; Poisoning by Hydroxyquinoline derivatives",,,,,
T37.9,"Poisoning by Systemic anti-infective and antiparasitic,unspecified",,,,,
Y40.0,"Drugs, medicaments and biological substances causingadverse effects in therapeuticuse: Systemic antibiotics: Penicillins",,,,,
Y40.1,"Drugs, medicaments and biological substances causingadverse effects in therapeuticuse: Systemic antibiotics: Cefalosporins and other beta-lactam antibiotics",,,,,
Y40.2,"Drugs, medicaments and biological substances causingadverse effects in therapeuticuse: Systemic antibiotics: Chloramphenicol group",,,,,
Y40.4,"Drugs, medicaments and biological substances causingadverse effects in therapeuticuse: Systemic antibiotics: Tetracyclines",,,,,
Y40.6,"Drugs, medicaments and biological substances causingadverse effects in therapeuticuse: Systemic antibiotics: Rifamycins",,,,,
Y40.8,"Drugs, medicaments and biological substances causingadverse effects in therapeuticuse: Systemic antibiotics: Other systemic antibiotics",,,,,
Y40.9,"Drugs, medicaments and biological substances causingadverse effects in therapeuticuse: Systemic antibiotics: Systemic antibiotic, unspecified",,,,,
Y41.0,"Drugs, medicaments and biological substances causingadverse effects in therapeutic use: Other systemic anti-infectives and antiparasitics; Sulfonamides",,,,,
Y41.1,"Drugs, medicaments and biological substances causingadverse effects in therapeutic use: Other systemic anti-infectives and antiparasitics; Antimycobacterial drugs",,,,,
Y41.5,"Drugs, medicaments and biological substances causingadverse effects in therapeutic use: Other systemic anti-infectives and antiparasitics; Antiviral drugs",,,,,
Y41.8,"Drugs, medicaments and biological substances causingadverse effects in therapeutic use:  Other specifiedsystemic anti-infectives and antiparasitics;hydroxyquinoline derivatives",,,,,
Y41.9,"Drugs, medicaments and biological substances causingadverse effects in therapeutic use: Systemic anti-infectiveand antiparasitic, unspecified",,,,,
Y56.0,"Drugs, medicaments and biological substances causingadverse effects in therapeutic use: Topical agents primarilyaffecting skin and mucous membrane andophthalmological, otorhinolaryngological and dental drugs:Local antifungal, anti-infective and anti-inflammatory drugs,not elsewhere classified",,,,,
T39.0,Poisoning by Salicylates,,,,,
T39.1,Poisoning by 4-Aminophenol derivatives,,,,,
T39.3,"Poisoning by Other nonsteroidal anti-inflammatory drugs[NSAID]",,,,,
T39.8,"Poisoning by Other nonopioid analgesics and antipyretics,not elsewhere classified",,,,,
T39.9,"Poisoning by Nonopioid analgesic, antipyretic andantirheumatic, unspecified",,,,,
Y45.8,Other analgesics and antipyretics,,,,,
Y45.9,"Drugs, medicaments and biological substances causingadverse effects in therapeuticuse: Analgesic, antipyretic and anti-inflammatory drug,unspecified",,,,,
T46.0,"Poisoning by Cardiac-stimulant glycosides and drugs ofsimilar action",,,,,
ICD 10 CODE,DESCRIPTION,,,,,
,,,,,,
T46.2,"Poisoning by Other antidysrhythmic drugs, not elsewhereclassified",,,,,
T46.3,"Poisoning by Coronary vasodilators, not elsewhereclassified; Poisoning by Dipyridamole",,,,,
T46.5,"Poisoning by Other antihypertensive drugs, not elsewhereclassified; Poisoning by Clonidine;Poisoning byGuanethidine; Poisoning by Rauwolfia",,,,,
T46.6,"Poisoning by Antihyperlipidaemic and antiarterioscleroticdrugs",,,,,
T46.7,"Poisoning by Peripheral vasodilators;Poisoning by Nicotimicacid (derivatives)",,,,,
T46.9,"Poisoning by Other and unspecified agents primarilyaffecting the cardiovascular system",,,,,
Y52.0,"Drugs, medicaments and biological substances causingadverse effects in therapeuticuse: Cardiac-stimulant glycosides and drugs of similaraction",,,,,
Y52.2,"Drugs, medicaments and biological substances causingadverse effects in therapeuticuse: Other antidysrhythmic drugs, not elsewhere classified",,,,,
T48.3,Poisoning by Antitussives,,,,,
T48.4,Poisoning by Expectorants,,,,,
T48.5,Poisoning by Anti-common-cold drugs,,,,,
T48.6,"Poisoning by Antiasthmatics, not elsewhere classified; β-adrenoreceptor agonists used in asthma theraphy;Poisoning by Salbutamol",,,,,
Y55.3,"Drugs, medicaments and biological substances causingadverse effects in therapeuticuse: Antitussives",,,,,
Y55.4,"Drugs, medicaments and biological substances causingadverse effects in therapeuticuse: Expectorants",,,,,
Y55.6,"Drugs, medicaments and biological substances causingadverse effects in therapeuticuse: Antiasthmatics, not elsewhere classified:aminophylline, salbutamol, theobromine;theophylline",,,,,
T50.0,Poisoning by Mineralocorticoids and their antagonists,,,,,
T50.1,Poisoning by Loop [high-ceiling] diuretics,,,,,
T50.2,"Poisoning by Carbonic-anhydrase inhibitors,benzothiadiazides and other diuretics;Poisoning byAcetazolamide",,,,,
T50.4,Poisoning by Drugs affecting uric acid metabolism,,,,,
T50.9,"Poisoning by Other and unspecified drugs, medicamentsand biological substances; Poisoning by Acidifying agents;Poisoning by Alkalizing agents; Poisoning byImmunoglobulin; Poisoning by Immunologicals; Poisoningby Lipotropic drugs;  Poisoning by Parathyroid hormonesand derivatives",,,,,
T47.0,Poisoning by HistamineH2-receptor antagonists,,,,,
T47.1,"Poisoning by Other antacids and anti-gastric-secretiondrugs",,,,,
T47.2,Poisoning by Stimulant laxatives,,,,,
T47.3,Poisoning by Saline and osmotic laxatives,,,,,
T47.4,"Poisoning by Other laxatives; Poisoning by Intestinal atoniadrugs",,,,,
T47.5,Poisoning by Digestants,,,,,
T47.6,Poisoning by Antidiarrhoeal drugs,,,,,
T47.8,"Poisoning by Other agents primarily affecting thegastrointestinal system",,,,,
T47.9,"Poisoning by Agent primarily affecting the gastrointestinalsystem, unspecified",,,,,
ICD 10 CODE,DESCRIPTION,,,,,
,,,,,,
