CODE,DESCRIPTION,,,,,
C37,Malignant neoplasm of thymus,,,,,
C38.0,"Malignant neoplasm of Heart; Malignant neoplasm ofPericardium",,,,,
C38.1,Malignant neoplasm of Anterior mediastinum,,,,,
C38.3,"Malignant neoplasm of Mediastinum, part unspecified",,,,,
C38.4,Malignant neoplasm of Pleura,,,,,
C38.8,"Malignant neoplasm of Overlapping lesion of heart,mediastinum and pleura",,,,,
C39.0,"Malignant neoplasm of Upper respiratory tract, partunspecified",,,,,
C39.8,"Malignant neoplasm of Overlapping lesion of respiratoryand intrathoracic organs",,,,,
C39.9,"Malignant neoplasm of Ill-defined sites within therespiratory system; Respiratory tract NOS",,,,,
C45.0,Mesothelioma of pleura,,,,,
C76.1,"Malignant neoplasm of Thorax;   Malignant neoplasm ofAxilla NOS;  Malignant neoplasm of Intrathoracic NOS;Malignant neoplasm of Thoracic NOS",,,,,
C77.1,"Secondary and unspecified malignant neoplasm ofIntrathoracic lymph nodes",,,,,
C78.0,Secondary malignant neoplasm of lung,,,,,
C78.1,Secondary malignant neoplasm of mediastinum,,,,,
C78.2,"Secondary malignant neoplasm of pleura; Malignant pleuraleffusion NOS",,,,,
C78.3,"Secondary malignant neoplasm of other and unspecifiedrespiratory organs",,,,,
C31.0,"Malignant neoplasm of Maxillary sinus; Malignantneoplasm of Antrum (Highmore);  Malignant neoplasm ofAntrum (maxillary)",,,,,
C31.1,Malignant neoplasm of Ethmoidal sinus,,,,,
C31.2,Malignant neoplasm of Frontal sinus,,,,,
C31.3,Malignant neoplasm of Sphenoidal sinus,,,,,
C31.8,"Malignant neoplasm of Overlapping lesion of accessorysinuses",,,,,
C31.9,"Malignant neoplasm of Accessory sinus, unspecified",,,,,
B21.0,"Human Immunodeficiency Virus [HIV] Disease resulting inKaposi's Sarcoma",,,,,
C46.9,"Kaposi's sarcoma, unspecified",,,,,
ICD 10 CODE,DESCRIPTION,,,,,
,,,,,,
C49.1,"Malignant neoplasm of  Connective and soft tissue of upperlimb, including shoulder",,,,,
C49.2,"Malignant neoplasm of Connective and soft tissue of lowerlimb, including hip",,,,,
C49.3,"Malignant neoplasm of Connective and soft tissue ofthorax;  Malignant neoplasm of Connective and soft tissueof Axilla;  Malignant neoplasm of Connective and soft tissueof Diaphragm; Malignant neoplasm of Connective and softtissue of Great vessels",,,,,
C49.4,"Malignant neoplasm of Connective and soft tissue ofabdomen; Malignant neoplasm of Connective and softtissue of Abdominal wall; Malignant neoplasm ofConnective and soft tissue of Hypochondrium",,,,,
C49.5,"Malignant neoplasm of Connective and soft tissue of pelvis;Malignant neoplasm of Connective and soft tissue ofButtock; Malignant neoplasm of Connective and soft tissueof  Groin; Malignant neoplasm of Connective and softtissue of Perineum",,,,,
C49.6,"Malignant neoplasm of Connective and soft tissue of trunk,unspecified; Malignant neoplasm of Connective and softtissue of Back NOS",,,,,
C49.8,"Malignant neoplasm of Overlapping lesion of connectiveand soft tissue",,,,,
C49.9,"Malignant neoplasm of Connective and soft tissue,unspecified",,,,,
C73,Malignant neoplasm of thyroid gland,,,,,
C74.0,Malignant neoplasm of Cortex of adrenal gland,,,,,
C74.1,Malignant neoplasm of Medulla of adrenal gland,,,,,
C74.9,"Malignant neoplasm of Adrenal gland, unspecified",,,,,
C75.0,Malignant neoplasm of Parathyroid gland,,,,,
C75.1,Malignant neoplasm of Pituitary gland,,,,,
C75.3,Malignant neoplasm of Pineal gland,,,,,
C75.5,Malignant neoplasm of Aortic body and other paraganglia,,,,,
C75.9,"Malignant neoplasm of Endocrine gland, unspecified",,,,,
E40,Kwashiorkor,,,,,
E41,Nutritional marasmus; Severe malnutrition with marasmus,,,,,
E42,"Marasmic kwashiorkor; Severe protein-energy malnutrition,intermediate form;  Severe protein-energy malnutritionwith signs of both kwashiorkor and marasmus",,,,,
E43,Unspecified severe protein-energy malnutrition,,,,,
E44.0,Moderate protein-energy malnutrition,,,,,
E44.1,Mild protein-energy malnutrition,,,,,
E45,"Retarded development following protein-energymalnutrition; Nutritional  short stature;  Nutritionalstunting; Physical retardation due to malnutrition",,,,,
E46,"Unspecified protein-energy malnutrition; Malnutrition NOS;Protein-energy imbalance NOS",,,,,
O10.0,"Pre-existing essential hypertension complicating pregnancychild birth and the puerperium",,,,,
O10.1,"Pre-existing hypertensive heart disease complicatingpregnancy, childbirth and the puerperium",,,,,
O10.2,"Pre-existing hypertensive renal disease complicatingpregnancy childbirth and the puerperium",,,,,
O10.3,"Pre-existing hypertensive heart and renal diseasecomplicating pregnancy, childbirth and the puerperium",,,,,
O10.4,"Pre-existing secondary hypertension complicatingpregnancy, childbirth and the puerperium",,,,,
O10.9,"Unspecified pre-existing hypertension complicatingpregnancy, childbirth and the puerperium",,,,,
O11,"Pre-existing hypertensive disorder with superimposedproteinuria",,,,,
O12.1,Gestational proteinuria,,,,,
O12.2,Gestational oedema with proteinuria,,,,,
ICD 10 CODE,DESCRIPTION,,,,,
,,,,,,
O14.0,Moderate pre-eclampsia,,,,,
O14.1,Severe pre-eclampsia,,,,,
O14.9,"Pre-eclampsia, unspecified",,,,,
O15.0,Eclampsia in pregnancy,,,,,
O15.1,Eclampsia in labour,,,,,
O15.9,"Eclampsia, unspecified as to time period; Eclampsia NOS",,,,,
O16,Unspecified maternal hypertension,,,,,
O20.0,"Threatened abortion; Haemorrhage specified as due tothreatened abortion",,,,,
O20.8,Other haemorrhage in early pregnancy,,,,,
O20.9,"Haemorrhage in early pregnancy, unspecified",,,,,
O21.0,"Mild hyperemesis gravidarum; Hyperemesis gravidarum,mild or unspecified, starting before the end of the 22ndweek of gestation",,,,,
O21.1,"Hyperemesis gravidarum with metabolic disturbance;Hyperemesis gravidarum, starting before the end of the22nd week of gestation, with metabolic disturbance such ascarbohydrate depletion, dehydration, elctrolyte imbalance",,,,,
O21.2,"Late vomiting of pregnancy; Excessive vomiting startingafter 22 completed weeks of gestation",,,,,
O21.8,"Other vomiting complicating pregnancy; Vomiting due todisease classified elsewhere, complicating pregnancy",,,,,
O21.9,"Vomiting of pregnancy, unspecified",,,,,
O22.3,"Deep phlebothrombosis in pregnancy; Deep-veinthrombosis, antepartum",,,,,
O22.5,"Cerebral venous thrombosis in pregnancy; Cerebrovenoussinus thrombosis in pregnancy",,,,,
O22.9,"Venous complication in pregnancy, unspecified; Gestationalphlebitis NOS; Gestational phlebopathy NOS; Gestationalthrombosis NOS",,,,,
O23.0,Infections of kidney in pregnancy,,,,,
O23.3,Infections of other parts of urinary tract in pregnancy,,,,,
O24.0,"Pre-existing diabetes mellitus, insulin-dependent",,,,,
O24.1,"Pre-existing diabetes mellitus, non-insulin-dependent",,,,,
O24.2,Pre-existing malnutrition-related diabetes mellitus,,,,,
O24.3,"Pre-existing diabetes mellitus, unspecified",,,,,
O24.4,"Diabetes mellitus arising in pregnancy; Gestational diabetesmellitus NOS",,,,,
O24.9,"Diabetes mellitus in pregnancy, unspecified",,,,,
O26.2,Pregnancy care of habitual aborter,,,,,
O26.3,Retained in trauterine contraceptive device in pregnancy,,,,,
O26.4,Herpes gestationis,,,,,
O26.5,"Maternal hypotension syndrome; Supine hypotensivesyndrome",,,,,
O26.6,"Liver disorders in pregnancy, childbirth and the puerperium",,,,,
O26.7,"Subluxation of symphysis (pubis) in pregnancy childbirthand the puerperium",,,,,
O26.8,"Other specified pregnancy-related conditions; Exhaustionand fatigue pregnancy-related; Peripheral neuritispregnancy-related; Renal disease pregnancy-related",,,,,
O26.9,"Pregnancy-relatedcondition, unspecified",,,,,
O28.0,"Abnormal haematological finding on antenatal screening ofmother",,,,,
O28.3,"Abnormal ultrasonic finding on antenatal screening ofmother",,,,,
O28.5,"Abnormal chromosomal and genetic finding on antenatalscreening of mother",,,,,
O28.8,Other abnormal findings on antenatal screening of mother,,,,,
O28.9,"Abnormal finding on antenatal screening of mother,unspecified",,,,,
O29.8,Other complications of anaesthesia during pregnancy,,,,,
O30.0,Twin pregnancy,,,,,
O30.1,Triplet pregnancy,,,,,
O30.8,Other multiple gestation,,,,,
O30.9,"Multiple gestation, unspecified; Multiple pregnancy NOS",,,,,
O31.0,Papyraceous fetus; Fetus compressus,,,,,
ICD 10 CODE,DESCRIPTION,,,,,
,,,,,,
O31.2,"Continuing pregnancy after intrauterine death of one fetusor more",,,,,
O31.8,Other complications specific to multiple gestation,,,,,
O32.0,Maternal care for unstable lie,,,,,
O32.1,Maternal care for breech presentation,,,,,
O32.2,"Maternal care for transverse and oblique lie; Obliquepresentation; Transverse presentation",,,,,
O32.3,"Maternal care for face, brow and chin presentation",,,,,
O32.4,"Maternal care for high head at term; Failure of head toenter pelvic brim",,,,,
O32.5,"Maternal care for multiple gestation with malpresentationof one fetus or more",,,,,
O32.6,Maternal care for compound presentation,,,,,
O32.8,Maternal care for other malpresentation of fetus,,,,,
O32.9,"Maternal care for malpresentation of fetus, unspecified",,,,,
O33.0,"Maternal care for disproportion due to deformity ofmaternal pelvic bones; Pelvic deformity causingdisproportion NOS",,,,,
O33.1,"Maternal care for disproportion due to generallycontracted pelvis; Contracted pelvis NOS causingdisproportion",,,,,
O33.2,"Maternal care for disproportion due to inlet contraction ofpelvis; Inlet contraction (pelvis) causing disproportion",,,,,
O33.3,"Maternal care for disproportion due to outlet contractionof pelvis; Mid-cavity contraction pelvis causingdisproportion; Outlet contraction pelvis causingdisproportion",,,,,
O33.4,"Maternal care for disproportion of mixed maternal andfetal origin",,,,,
O33.5,"Maternal care for disproportion due to unusually largefetus; Disproportion of fetal origin with normally formedfetus; Fetal disproportion NOS",,,,,
O33.6,Maternal care for disproportion due to hydrocephalic fetus,,,,,
O33.7,"Maternal care for disproportion due to other fetaldeformities; Conjoined twins; Fetal ascites causingdisproportion; Fetal hydrops causing disproportion; Fetalmeaningomyelocele causing disproportion; Fetal tumourcausing disproportion; Sacral teratoma causingdisproportion",,,,,
O33.9,"Maternal care for disproportion, unspecified; Cephalopelvicdisproportion NOS; Fetopelvic disproportion NOS",,,,,
O34.0,"Maternal care for congenital malformation of uterus;Maternal care for double uterus; Maternal care for Uterusbicornis",,,,,
O34.1,"Maternal care for tumour of corpus uteri; Maternal forpolyp of corpus uteri; Maternal care for uterine fibroid",,,,,
O34.2,"Maternal care due to uterine scar from previous surgery;Maternal care for scar from previous",,,,,
O34.3,"Maternal care for cervical incompetence; Maternal care forcerclage with or without mention of cervical incompetence;Maternal care for Shirodkar suture with or without mentionof cervical incompetence",,,,,
O34.4,"Maternal care for other abnormalities of cervix; Maternalcare for polyp of cervix; Maternal care for previous surgeryto cervix; Maternal care for stricture or stenosis of cervix;Maternal care for tumour of cervix",,,,,
O34.5,"Maternal care for other abnormalities of gravid uterus;Maternal care for incarceratiion of gravid uterus; Maternalcare for prolapse of gravid uterus; Maternal care forretroversion of gravid uterus",,,,,
O34.6,"Maternal care for abnormality of vagina; Maternal care forprevious surgery to vagina; Maternal care for septatevagina; Maternal care for acquired stenosis of vagina;Maternal care for congenital stenosis of vagina; Maternalcare for tumour of vagina",,,,,
ICD 10 CODE,DESCRIPTION,,,,,
,,,,,,
O34.8,"Maternal care for other abnormalities of pelvic organs;Maternal care for cystocele; Maternal care for previouspelvic floor repair; Maternal care for pendulous abdomen;Maternal care for rectocele; Maternal care for rigid pelvicfloor",,,,,
O34.9,"Maternal care for abnormality of pelvic organ, unspecified",,,,,
O35.0,"Maternal care for (suspected) central nervous systemmalformation in fetus; Maternal care for suspected fetalanencephaly; Maternal care for suspected fetal spina bifida",,,,,
O35.2,Maternal care for (suspected) hereditary disease in fetus,,,,,
O35.3,"Maternal care for (suspected) damage to fetus from viraldisease in mother; Maternal care for suspected damage tofetus from maternal cytomegalovirus infection; Maternalcare for suspected damage to fetus from maternal rubella",,,,,
O35.5,"Maternal care for (suspected) damage to fetus by drugs;Maternal care for suspected damage to fetus from drugaddiction",,,,,
O35.8,"Maternal care for other (suspected) fetal abnormality anddamage; Maternal care for suspected damage to fetus frommaternal listeriosis; Maternal care for suspected damage tofetus from maternal toxoplasmosis",,,,,
O35.9,"Maternal care for (suspected) fetal abnormality anddamage, unspecified",,,,,
O36.0,"Maternal care for rhesus isoimmunization; Anti-D [Rh]antibodies; Rh incompatibility (with hydrops fetalis)",,,,,
O36.1,"Maternal care for other isoimmunization; ABOisoimmunization; Isoimmunization NOS (with hydropsfetalis)",,,,,
O36.2,"Maternal care for hydrops fetalis; Hydrops fetalis NOS;Hydrops fetalis not associated with isoimmunization",,,,,
O36.3,Maternal care for signs of fetal hypoxia,,,,,
O36.4,Maternal care for intrauterine death,,,,,
O36.5,"Maternal care for poor fetal growth; Maternal care forknown or suspected light-for-dates; Maternal care forknown or suspected placental insufficiency; Maternal carefor known or suspected small-for-dates",,,,,
O36.6,"Maternal care for excessive fetal growth; Maternal care forknown or suspected large-for-dates",,,,,
O36.8,Maternal care for other specified fetal problems,,,,,
O36.9,"Maternal care for fetal problem, unspecified",,,,,
O40,Polyhydramnios; Hydramnios,,,,,
O41.0,"Oligohydramnios; Oligohydramnios without mention ofrupture of membrane",,,,,
O41.1,"Infection of amniotic sac and membranes; Amnionitis;Chorioamnionitis; Membranitis; Placentitis",,,,,
O41.8,Other specified disorders of amniotic fluid and membranes,,,,,
O41.9,"Disorder of amniotic fluid and membranes, unspecified;Premature rupture of membranes",,,,,
O42.0,"Premature rupture of membranes on set of labour within24 hours",,,,,
O42.1,"Premature rupture of membranes on set of labour after 24hours",,,,,
O42.2,"Premature rupture of membranes, labour delayed bytherapy",,,,,
O42.9,"Premature rupture of membranes, unspecified",,,,,
O43.0,"Placental transfusion syndromes; Fetomaternal transfusion;Maternofetal transfusion; Twin-to-twin transfusion",,,,,
O43.1,"Malformation of placenta; Abnormal placenta NOS;Circumvallate placenta",,,,,
O43.8,"Other placental disorders; Placental dysfunction; Placentalinfarction",,,,,
O43.9,"Placental disorder, unspecified",,,,,
O44.0,"Placenta praevia specified as without haemorrhage; Lowimplantation of placenta, NOS or with haemorrhage",,,,,
ICD 10 CODE,DESCRIPTION,,,,,
,,,,,,
O45.0,"Premature separation of placenta with coagulation defect;Abruptio placentae with (excessive) haemorrhageassociated with afibrinogenaemia;  Abruptio placentae with(excessive) haemorrhage associated with disseminatedintravascular coagulation;  Abruptio placentae with(excessive) hemorrhage associated withhyperfibrinogenaemia; Abruptio placentae with (excessive)haemorrhage associated with hypofibrinogenaemia",,,,,
O45.8,Other premature separation of placenta,,,,,
O45.9,"Premature separation of placenta, unspecified; Abruptioplacenta NOS",,,,,
O46.0,"Antepartum haemorrhage with coagulation defect;Antepartum haemorrhage (excessive) associated withafibrinogenaemia; Antepartum haemorrhage (excessive)associated with disseminated intravascular coagulation;Antepartum haemorrhage (excessive) associated withhyperfibrinolysis; Antepartum haemorrahge (excessive)associated with hypofibrinogenaemia",,,,,
O46.8,Other antepartum haemorrhage,,,,,
O46.9,"Antepartum haemorrhage, unspecified",,,,,
O47.0,False labour before 37 completed weeks of gestation,,,,,
O47.1,False labour at or after 37 completed weeks of gestation,,,,,
O47.9,"False labour, unspecified",,,,,
O48,Prolonged pregnancy; Post-dates; Post-term,,,,,
O98.0,"Tuberculosis complicating pregnancy, childbirth and thepuerperium",,,,,
O98.1,"Syphilis complicating pregnancy, childbirth and thepuerperium",,,,,
O98.2,"Gonorrhoea complicating pregnancy, childbirth and thepuerperium",,,,,
O98.3,"Other infections with apredominantly sexual mode oftransmission complicating pregnancy, childbirth and thepuerperium",,,,,
O98.4,"Viral hepatitis complicating pregnancy, childbirth and thepuerperium",,,,,
O98.5,"Other viral diseases complicating pregnancy,  childbirth andthe puerperium",,,,,
O98.6,"Protozoal diseases complicating pregnancy, childbirth andthe puerperium",,,,,
O98.8,"Other maternal infectious and parasitic diseasescomplicating pregnancy, childbirth and the puerperium",,,,,
O98.9,"Unspecified maternal infectious or parasitic diseasecomplicating pregnancy, childbirth and the puerperium",,,,,
O99.0,"Anaemia complicating pregnancy, childbirth and thepuerperium",,,,,
O99.1,"Other diseases of the blood and blood-forming organs andcertain disorders involving the immune mechanismcomplicating pregnancy, childbirth and the puerperium",,,,,
O99.2,"Endocrine, nutritional and metabolic diseases complicatingpregnancy, childbirth and the puerperium",,,,,
O99.3,"Mental disorders and diseases of the nervous systemcomplicating pregnancy, childbirth and the puerperium",,,,,
O99.4,"Diseases of the circulatory system complicating pregnancy,childbirth and the puerperium",,,,,
O99.5,"Diseases of the respiratory system complicating pregnancy,childbirth and the puerperium",,,,,
O99.6,"Diseases of the digestive system complicating pregnancy,childbirth and the puerperium",,,,,
O99.7,"Diseases of the skin and subcutaneous tissue complicatingpregnancy, childbirth and the puerperium",,,,,
O99.8,"Other specified diseases and conditions complicatingpregnancy, childbirth and the puerperium",,,,,
O60.0,"Preterm labor, not resulting to delivery",,,,,
Z34.0,Supervision of normal first pregnancy,,,,,
Z34.8,Supervision of other normal pregnancy,,,,,
Z34.9,"Supervision of normal pregnancy, unspecified",,,,,
Z35.0,Supervision of pregnancy with history of infertility,,,,,
ICD 10 CODE,DESCRIPTION,,,,,
,,,,,,
Z35.2,"Supervision of pregnancy with other poor reproductive orobstetric history; Supervision of pregnancy with history ofneonatal death; Supervision of pregnancy with history ofstillbirth",,,,,
Z35.4,Supervision of pregnancy with grand multiparity,,,,,
Z35.5,Supervision of elderly primigravida,,,,,
Z35.6,Supervision of very young primigravida,,,,,
Z35.7,Supervision of high-risk pregnancy due to social problems,,,,,
Z35.8,Supervision of other high-risk pregnancies,,,,,
Z35.9,"Supervision of high-risk pregnancy, unspecified",,,,,
A87.8,Other viral meningitis,,,,,
A87.9,"Viral meningitis, unspecified",,,,,
G00.0,"Haemophilus meningitis; Meningitis due to Haemophilusinfluenzae",,,,,
G00.1,Pneumococcal meningitis,,,,,
G00.2,Streptococcal meningitis,,,,,
G00.3,Staphylococcal meningitis,,,,,
G00.8,"Other bacterial meningitis; Meningitis due to Escherichiacoli; Meningitis due to Friedländer bacillus; Meningitis dueto Klebsiella",,,,,
G00.9,"Bacterial meningitis, unspecified; Meningitis purulent NOS;Meningitis pyogenic NOS; Meningitis suppurative NOS",,,,,
G03.0,Nonpyogenic meningitis; Nonbacterial meningitis,,,,,
G03.1,Chronic meningitis,,,,,
G03.8,Meningitis due to other specified causes,,,,,
G03.9,"Meningitis, unspecified; Arachnoiditis (spinal) NOS",,,,,
B05.1+ G02.0*,"Measles complicated by meningitis; Meningitis in viraldiseases classified elsewhere",,,,,
A39.2,Acute meningococcaemia,,,,,
A39.3,Chronic meningococcaemia,,,,,
A39.4,"Meningococcaemia, unspecified; Meningococcalbacteraemia NOS",,,,,
A39.9,"Meningococcal infection, unspecified; Meningococcaldisease NOS",,,,,
N91.0,"Primary amenorrhoea; Failure to start menstruation atpuberty.",,,,,
N91.1,"Secondary amenorrhoea; Absence of menstruation in awoman who had previously menstruated.",,,,,
N91.2,"Amenorrhoea, unspecified; Absence of menstruation NOS",,,,,
N91.5,"Oligomenorrhoea, unspecified; Hypomenorrhoea NOS",,,,,
N92.0,"Excessive and frequent menstruation with regular cycle;Heavy periods NOS; Menorrhagia NOS; Polymenorrhoea",,,,,
N92.1,"Excessive and frequent menstruation with irregular cycle;Irregular intermenstrual bleeding; Irregular, shortenedintervals between menstrual bleeding; Menometrorrhagia;Metrorrhagia",,,,,
N92.2,"Excessive menstruation at puberty; Excessive bleedingassociated with onset of menstrual periods; Pubertalmenorrhagia; Puberty bleeding",,,,,
N92.3,Ovulation bleeding; Regular intermenstrual bleeding,,,,,
N92.4,"Excessive bleeding in the premenopausal period; Climatericmenorrhagia or metrorrhagia; Menopausal menorrhagia ormetrorrhagia; Preclimateric menorrhagia or metrorrhagia;Premenopausal menorrhagia or metrorrhagia",,,,,
N92.5,Other specified irregular menstruation,,,,,
N92.6,"Irregular menstruation, unspecified; Irregular bleedingNOS; Irregular periods NOS",,,,,
N93.0,Postcoital and contact bleeding,,,,,
N93.8,"Other specified abnormal uterine and vaginal bleeding;Dysfunctional or functional uterine or vaginal bleeding NOS",,,,,
N93.9,"Abnormal uterine and vaginal bleeding, unspecifiedUterine hemorrhage not due to menstraution",,,,,
N94.8,"Other specified conditions associated with female genitalorgans and menstrual cycle",,,,,
N94.9,"Unspecified condition associated with female genitalorgans and menstrual cycle",,,,,
F01.1,Multi-infarct dementia; Predominantly cortical dementia,,,,,
F01.8,Other vascular dementia,,,,,
ICD 10 CODE,DESCRIPTION,,,,,
,,,,,,
F03,"Unspecified dementia; Presenile dementia NOS; Presenilepsychosis NOS; Senile dementia NOS; Senile dementiadepressed or paranoid type; Senile psychosis NOS",,,,,
F04,"Organic amnesic syndrome, not induced by alcohol andother psychoactive substances; Korsakov's psychosis orsyndrome, nonalcoholic",,,,,
F05.0,"Delirium not superimposed on dementia, so described",,,,,
F05.8,Other delirium,,,,,
F05.9,"Other delirium/Delirium, unspecified",,,,,
F06.0,"Organic hallucinosis; Organic hallucinatory state(nonalcoholic)",,,,,
F06.2,"Organic delusional [schizophrenia-like] disorder; Paranoidand paranoid-hallucinatory organic states; Schizophrenia-like psychosis in epilepsy",,,,,
F06.3,Organic mood [affective] disorders,,,,,
F06.4,Organic anxiety disorder,,,,,
F06.7,Mild cognitive disorder,,,,,
F06.8,"Other specified mental disorders due to brain damage anddysfunction and to physical disease; Epileptic psychosisNOS",,,,,
F06.9,"Unspecified mental disorder due to brain damage anddysfunction and to physical disease; Organic brainsyndrome NOS; Organic mental disorder NOS",,,,,
F07.0,"Organic personality disorder; Organic pseudopsychopathicpersonality;Organic pseudoretarded personality;   Frontal lobeSyndrome;  Limbic epilepsy personality Syndrome ;Lobotomy Syndrome;  Postleucotomy Syndrome",,,,,
F07.1,Postencephalitic syndrome,,,,,
F07.2,"Postconcussional syndrome; Postcontusional syndrome(encephalopathy); Post-traumatic brain syndrome,nonpsychotic",,,,,
F07.9,"Unspecified organic personality and behavioural disorderdue to brain disease, damage and dysfunction; Organicpsychosyndrome",,,,,
F09,"Unspecified organic or symptomatic mental disorder;Organic Psychosis NOS; Symptomatic Psychosis  NOS",,,,,
F10.0,"Mental and behavioural disorders due to use of alcohol inacute intoxication",,,,,
F10.1,"Mental and behavioural disorders due to use ofalcohol:harmful use",,,,,
F10.2,"Mental and behavioural disorders due to use of alcohol:dependency syndrome",,,,,
F10.3,"Mental and behavioural disorders due to use ofalcohol:withdrawal state",,,,,
F10.4,"Mental and behavioural disorders due to use of alcohol:withdrawal state with delirium",,,,,
F10.5,"Mental and behavioural disorders due to use of alcohol:psychotic disorder",,,,,
F10.6,"Mental and behavioural disorders due to use of alcohol:amnesic syndrome",,,,,
F10.7,"Mental and behavioural disorders due to use of alcohol:residual and late-onset psychotic disorder",,,,,
F10.8,"Mental and behavioural disorders due to use of alcohol:other mental and behavioural disorders",,,,,
F10.9,"Mental and behavioural disorders due to use of alcohol:unspecified mental and behavioural disorder",,,,,
F11.1,"Mental and behavioural disorders due to use of opioids:harmful use",,,,,
F11.2,"Mental and behavioural disorders due to use of opioids:dependence syndrome",,,,,
F11.5,"Mental and behavioural disorders due to use of opioids:psychotic disorder",,,,,
F11.9,"Mental and behavioural disorders due to use of opioids:unspecified mental and behavioural disorder",,,,,
F12.0,"Mental and behavioural disorders due to use ofcannabinoids: acute intoxication",,,,,
F12.5,"Mental and behavioural disorders due to use ofcannabinoids: psychotic disorder",,,,,
F13.1,"Mental and behavioural disorders due to use of sedativesor hypnotics: harmful use",,,,,
F13.2,"Mental and behavioural disorders due to use of sedativesor hypnotics: dependence syndrome",,,,,
ICD 10 CODE,DESCRIPTION,,,,,
,,,,,,
F13.4,"Mental and behavioural disorders due to use of sedativesor hypnotics: withdrawal state with delirium",,,,,
F13.5,"Mental and behavioural disorders due to use of sedativesor hypnotics: psychotic disorder",,,,,
F13.7,"Mental and behavioural disorders due to use of sedativesor hypnotics: residual and late-onset psychotic disorder",,,,,
F14.0,"Mental and behavioural disorders due to use of cocaine:acute intoxication",,,,,
