CODE,DESCRIPTION,,,,,
,,,,,,
P91.3,Neonatal cerebral irritability,,,,,
P91.4,Neonatal cerebral depression,,,,,
P91.6,Hypoxic ischaemic encephalopathy of newborn,,,,,
P91.8,Other specified disturbances of cerebral status of newborn,,,,,
P91.9,"Disturbance of cerebral status of newborn, unspecified",,,,,
J36,"Peritonsillar abscess; Abscess of tonsil; Peritonsillarcellulitis; Quinsy",,,,,
J38.7,"Other diseases of larynx; Abscess of larynx; Cellulitis oflarynx; Disease NOS of larynx; Necrosis of larynx;Pachyderma of larynx; Perichondritis of larynx; Ulcer oflarynx",,,,,
J39.0,"Retropharyngeal and parapharyngeal abscess;Peripharyngeal abscess",,,,,
J39.1,"Other abscess of pharynx; Cellulitis of pharynx;Nasopharyngeal abscess",,,,,
J39.2,"Other diseases of pharynx; Cyst of pharynx or nasopharynx;Oedema of pharynx or nasopharynx",,,,,
J85.1,Abscess of lung with pneumonia,,,,,
J85.2,Abscess of lung without pneumonia; Abscess of lung NOS,,,,,
J85.3,Abscess of mediastinum,,,,,
J86.0,Pyothorax with fistula,,,,,
J86.9,"Pyothorax without fistula; Abscess of pleura; Abscess ofthorax; Empyema; Pyopneumothorax",,,,,
A00.0,"Cholera due to Vibrio cholerae 01, biovar cholerae",,,,,
A00.1,"Cholera due to Vibrio cholerae 01, biovar eltor",,,,,
A00.9,"Cholera, unspecified",,,,,
A03.0,"Shigellosis due to Shigella dysenteriae; Group A shigellosis[Shiga-Kruse dysentery]",,,,,
A03.1,Shigellosis due to Shigella flexneri;Group B shigellosis,,,,,
A03.2,Shigellosis due to Shigella boydii; Group C shigellosis,,,,,
A03.3,Shigellosis due to Shigella sonnei; Group D shigellosis,,,,,
A03.8,Other shigellosis,,,,,
A03.9,"Shigellosis, unspecified; ; Bacillary dysentery NOS",,,,,
A04.0,Enteropathogenic Escherichia coli infection,,,,,
A04.1,Enterotoxigenic Escherichia coli infection,,,,,
A04.2,Enteroinvasive Escherichia coli infection,,,,,
A04.3,Enterohaemorrhagic Escherichia coli infection,,,,,
A04.4,Other intestinal Escherichia coli infections,,,,,
A04.5,Campylobacter enteritis,,,,,
A04.6,Enteritis due to Yersinia enterocolitica,,,,,
A04.7,"Enterocolitis due to Clostridium difficile; Foodborneintoxication by Clostridium difficile; Pseudomembranouscolitis",,,,,
A04.8,Other specified bacterial intestinal infections,,,,,
A04.9,"Bacterial intestinal infection, unspecified. Bacterial enteritisNOS",,,,,
A05.0,Foodborne staphylococcal intoxication,,,,,
A05.2,"Foodborne Clostridium perfringens [Clostridium welchii]intoxication. Enteritis necroticans.Pig-bel",,,,,
A05.3,Foodborne Vibrio parahaemolyticus intoxication,,,,,
A05.4,Foodborne Bacillus cereus intoxication,,,,,
A05.8,Other specified bacterial foodborne intoxications,,,,,
A05.9,"Bacterial foodborne intoxication, unspecified",,,,,
A07.0,Balantidiasis; Balantidial dysentery,,,,,
A07.1,Giardiasis [lambliasis],,,,,
A07.2,Cryptosporidiosis,,,,,
A07.3,"Isosporiasis; Infection due to Isospora belli and Isosporahominis; Intestinal coccidiosis; Isosporosis",,,,,
A07.8,"Other specified protozoal intestinal diseases; Intestinaltrichomoniasis; Sarcocystosis; Sarcosporidiosis",,,,,
A07.9,"Protozoal intestinal disease, unspecified;Flagellatediarrhoea; Protozoal colitis;  Protozoal diarrhoea; Protozoaldysentery",,,,,
A08.0,Rotaviral enteritis,,,,,
A08.1,"Acute gastroenteropathy due to Norovirus; Noroviralenteritis; Small round structured virus enteritis",,,,,
A08.2,Adenoviral enteritis,,,,,
A08.3,Other viral enteritis,,,,,
A08.4,"Viral intestinal infection, unspecified; Viral enteritis NOS;Viral gastroenteritis NOS; Viral gastroenteropathy NOS",,,,,
ICD 10 CODE,DESCRIPTION,,,,,
,,,,,,
A09.0,"Infectious diarrheaInfectious diarrhea with no dehydrationOther and unspecified gastroenteritis and colitis ofinfectious origin",,,,,
A09.9,"Gastroenteritis and colitis of unspecified origin; Neonataldiarrhoea NOS",,,,,
K52.0,Gastroenteritis and colitis due to radiation,,,,,
K52.1,Toxic gastroenteritis and colitis,,,,,
K52.2,"Allergic and dietetic gastroenteritis and colitis; Foodhypersensitivity gastroenteritis or colitis",,,,,
K52.8,"Other specified noninfective gastroenteritis and colitis;Eosinophilic gastritis or gastroenteritis",,,,,
K52.9,"Noninfective gastroenteritis and colitis, unspecified;Diarrhoea specified as noninfective, or NOS in countrieswhere the conditions can be presumed to be ofnoninfectious origin; Enteritis specified as noninfective, orNOS in countries where the conditions can be presumed tobe of noninfectious origin; Ileitis specified as noninfective,or NOS in countries where the conditions can be presumedto be noninfectious origin; Jejunitis specified asnoninfective, or NOS in countries where the conditions canbe presumed to be noninfectious origin; Sigmoiditispecified as noninfective, or NOS in countries where theconditions can be presumed to be noninfectious origin",,,,,
K58.0,Irritable bowel syndrome with diarrhoea,,,,,
N17.0,"Acute renal failure with tubular necrosis; Tubular necrosisNOS; Acute Tubular necrosis ; Renal Tubular necrosis",,,,,
N17.1,"Acute renal failure with acute cortical necrosis; Corticalnecrosis NOS; Acute Cortical necrosis ; Renal Corticalnecrosis",,,,,
N17.2,"Acute renal failure with medullary necrosis; Medullarypapillary necrosis, NOS; Acute medullary papillary necrosis;Renal medullary papillary necrosis",,,,,
N17.8,Other acute renal failure,,,,,
N17.9,"Acute renal failure, unspecified;",,,,,
O08.4,"Renal failure following abortion and ectopic and molarpregnancy; Oliguria Acute renal failure; Oliguria renalshutdown; Oliguria renal tubular necrosis; Oliguria Uraemia",,,,,
J80,"Adult respiratory distress syndrome; Adult hyalinemembrane disease",,,,,
T78.1,"Other adverse food reactions, not elsewhere classified",,,,,
T78.3,Angioneurotic oedema; Giant urticaria; Quinke's oedema,,,,,
T78.4,"Allergy, unspecified; Allergic reaction NOS; HypersensitivityNOS; Idiosyncracy NOS",,,,,
T78.8,"Other adverse effects, not elsewhere classified",,,,,
T78.9,"Adverse effect, unspecified",,,,,
T88.7,"Unspecified adverse effect of drug or medicament; Adverseeffect of correct drug or medicament properlyadministered; Allergic reactiion to correct drug ormedicament properly administered; Hypersensitivity tocorrect drug or medicament properly administered;Idiosyncracy to correct drug or medicament properlyadministered; Drug: hypersensitivity NOS; reaction NOS",,,,,
A06.4+ K77.0*,Amoebic liver abscess; Hepatic amoebiasis,,,,,
A06.0,"Acute amoebic dysentery; Acute amoebiasis; Intestinalamoebiasis NOS",,,,,
A06.1,Chronic intestinal amoebiasis,,,,,
A06.2,Amoebic nondysenteric colitis,,,,,
A06.3,Amoeboma of intestine; Amoeboma NOS,,,,,
A06.7,Cutaneous amoebiasis,,,,,
A06.8,"Amoebic infection of other sitesAmoebic Appendicitis; Amoebic balanitis (N51.2*)",,,,,
E85.8,Other amyloidosis; Localized amyloidosis,,,,,
T78.0,Anaphylactic shock due to adverse food reaction,,,,,
T78.2,"Anaphylactic shock, unspecified; Allergic shock NOS;Anaphylactic reaction NOS; Anaphylaxis NOS",,,,,
T88.6,"Anaphylactic shock due to adverse effect of correct drug ormedicament properly administered",,,,,
ICD 10 CODE,DESCRIPTION,,,,,
,,,,,,
D50.1,"Sideropenic dysphagia; Kelly-Paterson syndrome;  Plummer-Vinson syndrome",,,,,
D50.8,Other iron deficiency anaemias,,,,,
D50.9,"Iron deficiency anaemia, unspecified",,,,,
D51.0,"Vitamin B12 deficiency anaemia due to intrinsic factordeficiency;  Addison Anaemia; Biermer  Anaemia;Congenital Pernicious  Anaemia; Congenital intrinsic factordeficiencyPernicious anemia",,,,,
D51.8,Other vitamin B12 deficiency anaemias,,,,,
D51.9,"Vitamin B12 deficiency anaemia, unspecified",,,,,
D52.1,"Drug-induced folate deficiency anaemiaUse additional external cause code (Chapter XX), if desiredto identify drug",,,,,
D52.9,"Folate deficiency anaemia, unspecified; Folic acid deficiencyanaemia NOS",,,,,
D53.0,"Protein deficiency anaemia; Amino-acid  deficiencyanaemia; Orotaciduric anaemia",,,,,
D53.1,"Other megaloblastic anaemias, not elsewhere classified;Megaloblastic anaemia NOS",,,,,
D53.2,Scorbutic anaemia,,,,,
D53.8,"Other specified nutritional anaemias; Anaemia associatedwith deficiency of copper;  Anaemia associated withdeficiency of molybdenum; Anaemia associated withdeficiency of  zinc",,,,,
D53.9,"Nutritional anaemia, unspecified; Simple chronic anaemia",,,,,
D55.0,"Anaemia due to glucose-6-phosphate dehydrogenase[G6PD] deficiency; Favism;G6PD deficiency anaemia",,,,,
D55.1,"Anaemia due to other disorders of glutathione metabolism;Anaemia due to enzyme deficiencies, except G6PD, relatedto the hexose monophosphate [HMP] shunt pathway;Anaemia due to haemolytic nonspherocytic hereditary,type I",,,,,
D55.2,"Anaemia due to disorders of glycolytic enzymes;Haemolytic nonspherocytic hereditary Anaemia, type II;Hexokinase deficiency Anaemia; Pyruvate kinase [PK]deficiency Anaemia; Triose-phosphate isomerase deficiencyAnaemia",,,,,
D55.8,Other anaemias due to enzyme disorders,,,,,
D55.9,"Anaemia due to enzyme disorder, unspecified",,,,,
D56.9,"Thalassaemia, unspecifiedMediterranean anaemia;  Mediterranean anaemia withother haemoglobinopathy; Thalassaemia minor with otherhaemoglobinopathy; Thalassaemia mixed with otherhaemoglobinopathy;",,,,,
D57.0,Sickle-cell anaemia with crisis; Hb-SS disease with crisis,,,,,
D57.1,"Sickle-cell anaemia without crisis; Sickle-cell anaemia NOS;Sickle-cell  disease NOS ; Sickle-cell disorder NOS",,,,,
D57.3,Sickle-cell trait; Hb-S trait ; Heterozygous Haemoglobin S,,,,,
D57.8,Other sickle-cell disorders,,,,,
D58.0,"Hereditary spherocytosis; Acholuric (familial) jaundice;Congenital (spherocytic) haemolytic icterus; Minkowski-Chauffard syndrome",,,,,
D58.1,"Hereditary elliptocytosis; Congenital Elliptocytosis;Congenital Ovalocytosis; Hereditary Ovalocytosis",,,,,
D58.2,"Other haemoglobinopathies; Abnormal haemoglobin NOS;Congenital Heinz body anaemia;  Hb-C Disease;  Hb-CDisease;  Hb-D Disease;  Hb-E Disease; HaemoglobinopathyNOS;  Unstable haemoglobin haemolytic disease",,,,,
D58.8,"Other specified hereditary haemolytic anaemias;Stomatocytosis",,,,,
D58.9,"Hereditary haemolytic anaemia, unspecified; Acquiredhaemolytic anaemia",,,,,
D59.0,Drug-induced autoimmune haemolytic anaemia,,,,,
ICD 10 CODE,DESCRIPTION,,,,,
,,,,,,
D59.2,"Drug-induced nonautoimmune haemolytic anaemia; Drug-induced enzyme deficiency anaemia",,,,,
D59.4,"Other nonautoimmune haemolytic anaemias; MechanicalHaemolytic anaemia; Microangiopathic Haemolyticanaemia; Toxic Haemolytic anaemia",,,,,
D59.5,"Paroxysmal nocturnal haemoglobinuria [Marchiafava-Micheli]",,,,,
D59.6,"Haemoglobinuria due to haemolysis from other externalcauses; Haemoglobinuria from exertion;  Haemoglobinuriamarch; Haemoglobinuria paroxysmal cold",,,,,
D59.8,Other acquired haemolytic anaemias,,,,,
D59.9,"Acquired haemolytic anaemia, unspecified; ChronicIdiopathic haemolytic anaemia",,,,,
D60.1,Transient acquired pure red cell aplasia,,,,,
D61.0,"Constitutional aplastic anaemia;  Congenital Pure red cellAplasia;  Pure red cell  Aplasia of infants;  Primary Pure redcell  Aplasia; Blackfan-Diamond syndrome; Familialhypoplastic anaemia; Fanconi's anaemia; Pancytopeniawith malformations",,,,,
D61.1,Drug-induced aplastic anaemia,,,,,
D61.2,Aplastic anaemia due to other external agents,,,,,
D61.3,Idiopathic aplastic anaemia,,,,,
D61.8,Other specified aplastic anaemias,,,,,
D61.9,"Aplastic anaemia, unspecified; Hypoplastic anaemia NOS;Medullary hypoplasia; Panmyelophthisis",,,,,
D62,Acute posthaemorrhagic anaemia,,,,,
D63.0*,Anaemia in neoplastic disease,,,,,
D63.8*,Anaemia in other chronic diseases classified elsewhere,,,,,
D64.0,"Hereditary sideroblastic anaemia; Sex-linked hypochromicsideroblastic anaemia",,,,,
D64.1,Secondary sideroblastic anaemia due to disease,,,,,
D64.2,Secondary sideroblastic anaemia due to drugs and toxins,,,,,
D64.3,"Other sideroblastic anaemias; Sideroblastic anaemia NOS;pyridoxine-responsive NEC Sideroblastic anaemia",,,,,
D64.8,"Other specified anaemias; Infantile pseudoleukaemia;Leukoerythroblastic anaemia",,,,,
D64.9,"Anaemia, unspecifiedSevere anemia",,,,,
M00.16,"Pneumococcal arthritis and polyarthritis, Lower leg",,,,,
M00.19,"Pneumococcal arthritis and polyarthritis,  Site unspecified",,,,,
M00.29,"Other streptococcal arthritis and polyarthritis, Siteunspecified",,,,,
M00.82,"Arthritis and polyarthritis due to other specified bacterialagents upper arm",,,,,
M00.90,"Pyogenic arthritis, unspecified; Infective arthritis NOSmultiple sites",,,,,
M00.91,"Pyogenic arthritis, unspecified; Infective arthritis NOSshoulder region",,,,,
M00.93,"Pyogenic arthritis, unspecified; Infective arthritis NOSforearm",,,,,
M00.94,"Pyogenic arthritis, unspecified; Infective arthritis NOShand",,,,,
M00.95,"Pyogenic arthritis, unspecified; Infective arthritis NOSpelvic region and thigh",,,,,
M00.96,"Pyogenic arthritis, unspecified; Infective arthritis NOSlower leg",,,,,
M00.97,"Pyogenic arthritis, unspecified; Infective arthritis NOSankle and foot",,,,,
M00.98,"Pyogenic arthritis, unspecified; Infective arthritis NOSother sites",,,,,
M00.99,"Pyogenic arthritis, unspecified; Infective arthritis NOSsite unspecified",,,,,
M02.39,"Reiter's disease, site unspecified",,,,,
M06.19,"Adult-onset Still's disease, site unspecified",,,,,
M08.29,"Juvenile arthritis with systemic onset; Still's disease NOSsite unspecified",,,,,
M02.99,"Reactive arthropathy, unspecified, site unspecified",,,,,
M05.99,"Seropositive rheumatoid arthritis, unspecified, siteunspecified",,,,,
M06.01,"Seronegative rheumatoid arthritis, shoulder region",,,,,
M06.09,"Seronegative rheumatoid arthritis, site unspecified",,,,,
M06.36,"Rheumatoid nodule, lower leg",,,,,
ICD 10 CODE,DESCRIPTION,,,,,
,,,,,,
M06.49,"Inflammatory polyarthropathy, site unspecified",,,,,
M06.81,"Other specified rheumatoid arthritis, shoulder region",,,,,
M06.86,"Other specified rheumatoid arthritis, lower leg",,,,,
M06.87,"Other specified rheumatoid arthritis, ankle and foot",,,,,
M06.89,"Other specified rheumatoid arthritis, site unspecified",,,,,
M06.90,"Rheumatoid arthritis, unspecified, multiple sites",,,,,
M06.91,"Rheumatoid arthritis, unspecified, shoulder region",,,,,
M06.93,"Rheumatoid arthritis, unspecified, forearm",,,,,
M06.94,"Rheumatoid arthritis, unspecified, hand",,,,,
M06.95,"Rheumatoid arthritis, unspecified, pelvic region and thigh",,,,,
M06.96,"Rheumatoid arthritis, unspecified, lower leg",,,,,
M06.97,"Rheumatoid arthritis, unspecified, ankle and foot",,,,,
M06.98,"Rheumatoid arthritis, unspecified, other sites",,,,,
M06.99,"Rheumatoid arthritis, unspecified, site unspecified",,,,,
M08.06,"Juvenile rheumatoid arthritis; Juvenile rheumatoid arthritiswith or without rheumatoid factor  lower leg",,,,,
M08.07,"Juvenile rheumatoid arthritis; Juvenile rheumatoid arthritiswith or without rheumatoid factor  ankle and foot",,,,,
M08.09,"Juvenile rheumatoid arthritis; Juvenile rheumatoid arthritiswith or without rheumatoid factor  site unspecified",,,,,
M08.19,Juvenile ankylosing spondylitis site unspecified,,,,,
M08.86,Other juvenile arthritis lower leg,,,,,
M08.89,Other juvenile arthritis site unspecified,,,,,
M08.91,"Juvenile arthritis, unspecified shoulder region",,,,,
M08.96,"Juvenile arthritis, unspecified lower leg",,,,,
M08.99,"Juvenile arthritis, unspecified site unspecified",,,,,
M10.00,Idiopathic gout; Gouty bursitis; Primary gout  multiple sites,,,,,
M10.01,"Idiopathic gout; Gouty bursitis; Primary gout;Urate tophus of heart shoulder region",,,,,
M10.02,"Idiopathic gout; Gouty bursitis; Primary gout;Urate tophus of heart upper arm",,,,,
M10.03,Idiopathic gout; Gouty bursitis; Primary gout  forearm,,,,,
M10.04,"Idiopathic gout; Gouty bursitis; Primary gout;Urate tophus of heart hand",,,,,
M10.05,"Idiopathic gout; Gouty bursitis; Primary gout;Urate tophusof heart pelvic region and thigh",,,,,
M10.06,Idiopathic gout; Gouty bursitis; Primary gout  lower leg,,,,,
M10.07,"Idiopathic gout; Gouty bursitis; Primary gout;Urate tophus of heart ankle and foot",,,,,
M10.08,"Idiopathic gout; Gouty bursitis; Primary gout;Urate tophus of heart other sites",,,,,
M10.09,"Idiopathic gout; Gouty bursitis; Primary gout;Urate tophus of heart site unspecified",,,,,
M10.10,Lead-induced gout   multiple sites,,,,,
M10.29,Drug-induced gout site unspecified,,,,,
M10.30,Gout due to impairment of renal function multiple sites,,,,,
M10.36,Gout due to impairment of renal function lower leg,,,,,
M10.39,Gout due to impairment of renal function site unspecified,,,,,
M10.40,Other secondary gout multiple sites,,,,,
M10.49,Other secondary gout site unspecified,,,,,
M10.90,"Gout, unspecified multiple sites",,,,,
M10.91,"Gout, unspecified shoulder region",,,,,
M10.92,"Gout, unspecified upper arm",,,,,
M10.93,"Gout, unspecified forearm",,,,,
M10.94,"Gout, unspecified hand",,,,,
M10.96,"Gout, unspecified lower leg",,,,,
M10.97,"Gout, unspecified ankle and foot",,,,,
M10.98,"Gout, unspecified other sites",,,,,
M10.99,"Gout, unspecified site unspecified",,,,,
M11.89,Other specified crystal arthropathies site unspecified,,,,,
M11.90,"Crystal arthropathy, unspecified multiple sites",,,,,
M11.99,"Crystal arthropathy, unspecified site unspecified",,,,,
M12.26,Villonodular synovitis (pigmented) lower leg,,,,,
M12.39,Palindromic rheumatism site unspecified,,,,,
M12.50,Traumatic arthropathy multiple sites,,,,,
M12.52,Traumatic arthropathy upper arm,,,,,
M12.53,Traumatic arthropathy forearm,,,,,
M12.54,Traumatic arthropathy hand,,,,,
M12.55,Traumatic arthropathy pelvic region and thigh,,,,,
ICD 10 CODE,DESCRIPTION,,,,,
,,,,,,
M12.57,Traumatic arthropathy ankle and foot,,,,,
M12.58,Traumatic arthropathy other sites,,,,,
M12.59,Traumatic arthropathy site unspecified,,,,,
M12.86,"Other specific arthropathies, not elsewhere classified;Transient arthropathy  lower leg",,,,,
M12.89,"Other specific arthropathies, not elsewhere classified;Transient arthropathy  site unspecified",,,,,
M13.00,"Polyarthritis, unspecified multiple sites",,,,,
M13.01,"Polyarthritis, unspecified shoulder region",,,,,
M13.02,"Polyarthritis, unspecified upper arm",,,,,
M13.06,"Polyarthritis, unspecified lower leg",,,,,
M13.09,"Polyarthritis, unspecified site unspecified",,,,,
M13.13,"Monoarthritis, not elsewhere classified forearm",,,,,
M13.16,"Monoarthritis, not elsewhere classified lower leg",,,,,
M13.17,"Monoarthritis, not elsewhere classified ankle and foot",,,,,
M13.18,"Monoarthritis, not elsewhere classified other sites",,,,,
M13.80,Other specified arthritis; Allergic arthritis  multiple sites,,,,,
M13.81,Other specified arthritis; Allergic arthritis  shoulder region,,,,,
M13.85,"Other specified arthritis; Allergic arthritis  pelvic region andthigh",,,,,
M13.86,Other specified arthritis; Allergic arthritis  lower leg,,,,,
M13.87,Other specified arthritis; Allergic arthritis  ankle and foot,,,,,
M13.88,Other specified arthritis; Allergic arthritis  other sites,,,,,
M13.89,Other specified arthritis; Allergic arthritis  site unspecified,,,,,
M13.90,"Arthritis, unspecified; Arthropathy NOS multiple sites",,,,,
M13.91,"Arthritis, unspecified; Arthropathy NOS shoulder region",,,,,
M13.92,"Arthritis, unspecified; Arthropathy NOS upper arm",,,,,
M13.93,"Arthritis, unspecified; Arthropathy NOS forearm",,,,,
M13.94,"Arthritis, unspecified; Arthropathy NOS hand",,,,,
M13.95,"Arthritis, unspecified; Arthropathy NOS pelvic region andthigh",,,,,
M13.96,"Arthritis, unspecified; Arthropathy NOS lower leg",,,,,
M13.97,"Arthritis, unspecified; Arthropathy NOS ankle and foot",,,,,
M13.98,"Arthritis, unspecified; Arthropathy NOS other sites",,,,,
M13.99,"Arthritis, unspecified; Arthropathy NOS site unspecified",,,,,
A92.0,"Chikungunya virus disease; Chikungunya (haemorrhagic)fever",,,,,
A92.1,O'nyong-nyong fever,,,,,
A92.2,"Venezuelan equine fever;  Venezuelan equine encephalitis;Venezuelan encephalomyelitis virus disease",,,,,
A92.8,Other specified mosquito-borne viral fevers,,,,,
A93.1,Sandfly fever; Pappataci fever; Phlebotomus fever,,,,,
A93.8,"Other specified arthropod-borne viral fevers; Piry virusdisease; Severe fever with thrombocytopenia syndrome[SFTS]; Vesicular stomatitis virus disease [Indiana fever]",,,,,
A94,"Unspecified arthropod-borne viral fever; Unspecifiedarthropod-borne viral fever; Arboviral fever NOS; Arbovirusinfection NOSAcute hemorrhagic fever",,,,,
M15.0,Primary generalized (osteo)arthrosis,,,,,
M15.2,Bouchard's nodes (with arthropathy),,,,,
M15.3,Secondary multiple arthrosis; Post-traumatic polyarthrosis,,,,,
M15.4,Erosive (osteo)arthrosis,,,,,
M15.8,Other polyarthrosis,,,,,
M15.9,"Polyarthrosis, unspecified; Generalized osteoarthritis NOS",,,,,
M16.0,"Primary coxarthrosis, bilateral",,,,,
M16.1,"Other primary coxarthrosis; Primary coxarthrosis NOS;Primary coxarthrosis unilateral",,,,,
M16.2,"Coxarthrosis resulting from dysplasia, bilateral",,,,,
M16.3,"Other dysplastic coxarthrosis; Dysplastic coxarthrosis NOS;Dysplastic coxarthrosis unilateral",,,,,
M16.9,"Coxarthrosis, unspecified",,,,,
M17.0,"Primary gonarthrosis, bilateral",,,,,
M17.1,"Other primary gonarthrosis; Primary gonarthrosis NOS;Primary gonarthrosis unilateral",,,,,
ICD 10 CODE,DESCRIPTION,,,,,
,,,,,,
M17.3,"Other post-traumatic gonarthrosis; Post-traumaticgonarthrosis NOS; Post-traumatic gonarthrosis unilateral",,,,,
M17.5,"Other secondary gonarthrosis; Secondary gonarthrosisNOS; Secondary gonarthrosis unilateral",,,,,
M17.9,"Gonarthrosis, unspecified",,,,,
M18.0,"Primary arthrosis of first carpometacarpal joints, bilateral",,,,,
M18.9,"Arthrosis of first carpometacarpal joint, unspecified",,,,,
M19.00,"Primary arthrosis of other joints; Primary arthrosisNOSmultiple sites",,,,,
M19.02,"Primary arthrosis of other joints; Primary arthrosisNOSupper arm",,,,,
M19.05,"Primary arthrosis of other joints; Primary arthrosisNOSpelvic region and thigh",,,,,
M19.06,"Primary arthrosis of other joints; Primary arthrosisNOSlower leg",,,,,
M19.08,"Primary arthrosis of other joints; Primary arthrosisNOSother sites",,,,,
M19.09,"Primary arthrosis of other joints; Primary arthrosis NOSsiteunspecified",,,,,
M19.10,"Post-traumatic arthrosis of other joints; Post-traumaticarthrosis NOS multiple sites",,,,,
M19.11,"Post-traumatic arthrosis of other joints; Post-traumaticarthrosis NOS shoulder region",,,,,
M19.12,"Post-traumatic arthrosis of other joints; Post-traumaticarthrosis NOS upper arm",,,,,
M19.19,"Post-traumatic arthrosis of other joints; Post-traumaticarthrosis NOS site unspecified",,,,,
M19.21,"Other secondary arthrosis; Secondary arthrosis NOSshoulder region",,,,,
M19.29,"Other secondary arthrosis; Secondary arthrosis NOS siteunspecified",,,,,
M19.81,Other specified arthrosis shoulder region,,,,,
M19.86,Other specified arthrosis lower leg,,,,,
M19.87,Other specified arthrosis ankle and foot,,,,,
M19.88,Other specified arthrosis other sites,,,,,
M19.89,Other specified arthrosis site unspecified,,,,,
M19.90,"Arthrosis, unspecified multiple sites",,,,,
M19.91,"Arthrosis, unspecified shoulder region",,,,,
M19.92,"Arthrosis, unspecified upper arm",,,,,
M19.93,"Arthrosis, unspecified forearm",,,,,
M19.94,"Arthrosis, unspecified hand",,,,,
M19.95,"Arthrosis, unspecified pelvic region and thigh",,,,,
M19.96,"Arthrosis, unspecified lower leg",,,,,
M19.97,"Arthrosis, unspecified ankle and foot",,,,,
M19.98,"Arthrosis, unspecified other sites",,,,,
M19.99,"Arthrosis, unspecified site unspecifiedOsteoarthritis",,,,,
J45.00,"Predominantly allergic asthma; Allergic bronchitis NOS;Allergic rhinitis with asthma; Atopic asthma; Extrinsicallergic asthma; Hay fever with asthma; in AcuteExacerbation",,,,,
J45.10,"Nonallergic asthma; Idiosyncratic asthma; Intrinsicnonallergic asthma, in Acute Exacerbation",,,,,
J45.80,"Mixed asthma, in Acute Exacerbation",,,,,
J45.90,Bronchial Asthma in Acute Exacerbation,,,,,
J46,Status asthmaticus; Acute severe asthma,,,,,
J98.1,"Pulmonary collapse; Atelectasis; Collapse of lung; Brock'ssyndrome",,,,,
M54.01,"Panniculitis affecting regions of neck and back  occipito-atlanto-axial region",,,,,
M54.06,"Panniculitis affecting regions of neck and back  lumbarregion",,,,,
M54.08,"Panniculitis affecting regions of neck and back  sacral andsacrococcygeal region",,,,,
M54.10,"Radiculopathy; Brachial Neuritis or radiculitis   NOS;Lumbar Neuritis or radiculitis   NOS;  Lumbosacral; thoracicNeuritis or radiculitis   NOS ; Radiculitis NOSMultiple sites in spine",,,,,
ICD 10 CODE,DESCRIPTION,,,,,
,,,,,,
M54.12,"Radiculopathy; Brachial Neuritis or radiculitis   NOS;Lumbar Neuritis or radiculitis   NOS;  Lumbosacral; thoracicNeuritis or radiculitis   NOS ; Radiculitis NOScervical region",,,,,
M54.14,"Radiculopathy; Brachial Neuritis or radiculitis   NOS;Lumbar Neuritis or radiculitis   NOS;  Lumbosacral; thoracicNeuritis or radiculitis   NOS ; Radiculitis NOSthoracic region",,,,,
M54.15,"Radiculopathy; Brachial Neuritis or radiculitis   NOS;Lumbar Neuritis or radiculitis   NOS;  Lumbosacral; thoracicNeuritis or radiculitis   NOS ; Radiculitis NOSthoracolumbar region",,,,,
M54.16,"Radiculopathy; Brachial Neuritis or radiculitis   NOS;Lumbar Neuritis or radiculitis   NOS;  Lumbosacral; thoracicNeuritis or radiculitis   NOS ; Radiculitis NOSlumbar region",,,,,
M54.17,"Radiculopathy; Brachial Neuritis or radiculitis   NOS;Lumbar Neuritis or radiculitis   NOS;  Lumbosacral; thoracicNeuritis or radiculitis   NOS ; Radiculitis NOSlumbosacral region",,,,,
M54.18,"Radiculopathy; Brachial Neuritis or radiculitis   NOS;Lumbar Neuritis or radiculitis   NOS;  Lumbosacral; thoracicNeuritis or radiculitis   NOS ; Radiculitis NOSsacral and sacrococcygeal region",,,,,
